{
  "format": "manuscript",
  "formatVersion": 1,
  "title": "Les Heures claires",
  "language": "fr",
  "scenes": [
    {
      "title": "Ouverture",
      "blocks": [
        {
          "kind": "narration",
          "text": "La pluie battait les vitres. Marie guettait la rue depuis l’aube."
        },
        {
          "kind": "dialogue",
          "speaker": "Marie",
          "parts": [
            { "tone": "à voix basse" },
            { "text": "Tu es venu." },
            { "tone": "plus fort, sans se retourner" },
            { "text": "Tu avais promis d’écrire." }
          ]
        },
        {
          "kind": "dialogue",
          "speaker": "Paul",
          "parts": [{ "text": "Je suis là, maintenant." }]
        }
      ]
    },
    {
      "title": "Interlude",
      "blocks": []
    },
    {
      "title": "Dénouement",
      "blocks": [
        {
          "kind": "narration",
          "text": "Au matin, la pluie avait cessé.\n\nPaul était parti."
        }
      ]
    }
  ],
  "appendices": {}
}
